id,created_at,text
1330494852082008066,2020-11-22 12:54:26,Speaking at the #G20RiyadhSummit. https://t.co/lCqzRQnKhD
1330481817275617280,2020-11-22 12:02:39,"आज ‘सबका साथ, सबका विकास, सबका विश्वास’, यह मंत्र देश के हर हिस्से, हर नागरिक के विश्वास का मंत्र बन चुका है।
 
देश… https://t.co/wqkx0Hxzr5"
1330481628515348489,2020-11-22 12:01:54,"गांव में विश्वास और विकास की कमी में एक बड़ी समस्या रही है, घर-जमीन से जुड़े विवाद। अब इसके स्थायी समाधान के लिए… https://t.co/EnLjyePNVV"
1330481454002958347,2020-11-22 12:01:12,"हमारे गांवों को, गांव में रहने वाले गरीबों को और आदिवासियों को जितनी प्राथमिकता हमारी सरकार ने दी, उतनी पहले नहीं… https://t.co/rDyLU1yvf1"
1330481158379905024,2020-11-22 12:00:01,"आज जो योजनाएं बनाई जा रही हैं, उनसे अनेक लक्ष्य सिद्ध हो रहे हैं।
 
जल जीवन मिशन के तहत घर-घर पानी पहुंचने से हमारी… https://t.co/DWcusDP9Wf"
1330480928397750272,2020-11-22 11:59:07,विंध्याचल की सबसे बड़ी परेशानी को दूर करने के लिए निरंतर काम किया गया है। यहां घर-घर जल पहुंचाने और सिंचाई की सुवि… https://t.co/C3BZlR52d4
1330417376400175104,2020-11-22 07:46:35,Spoke to Shri Mulayam Singh Yadav Ji and greeted him on his birthday. He is one of the senior-most and experienced… https://t.co/yP676tDpnu
1330394400145412097,2020-11-22 06:15:17,Harnessing #JalShakti4UP. Watch. https://t.co/ZKtykwgbQ9
1330190462209155072,2020-11-21 16:44:54,We offered India's IT prowess to further develop digital facilities for efficient functioning of the #G20.
1330190460128727043,2020-11-21 16:44:54,Transparency in our processes helps in inspiring our societies to fight crisis collectively and with confidence. Sp… https://t.co/zXmbcASHzp
1330190458002268161,2020-11-21 16:44:53,Multi-skilling and re-skilling to build a talent pool will enhance dignity and resilience of our workers. Value of… https://t.co/bAZqMl4hKJ
1330190454315495426,2020-11-21 16:44:52,"At the #G20 Summit, I put forward a need to develop a new global index based on talent, technology, transparency an… https://t.co/1LUW69bs0b"
1330190452075732995,2020-11-21 16:44:52,Had a very fruitful discussion with G20 leaders. Coordinated efforts by the largest economies of the world will sur… https://t.co/zsxx9b4F6c
1330177344439537675,2020-11-21 15:52:47,उत्तर प्रदेश के विंध्‍याचल क्षेत्र के लाखों लोगों के लिए कल का दिन बेहद महत्वपूर्ण है। सुबह 11.30 बजे वीडियो कॉ… https://t.co/Rq5PBhhZgd
1330117283247759364,2020-11-21 11:54:07,"बदलाव चाहे खुद में करना हो या दुनिया में, बदलाव कभी एक दिन, एक हफ्ते या एक साल में नहीं होता।
 
बदलाव के लिए थोड़ा-… https://t.co/iACMoFQf3L"
1330117131376209922,2020-11-21 11:53:31,"जैसे भविष्य, प्रकृति, पर्यावरण और विकास के लिए क्लीन एनर्जी की बात होती है, वैसे ही जीवन में दो बातें और जरूरी हैं-… https://t.co/FcAkNUMlZb"
1330116956393975811,2020-11-21 11:52:49,"सफलता की सबसे बड़ी कुंजी Sense of Responsibility होती है। जो विफल होते हैं, वे Sense of Burden के नीचे दबे होते हैं… https://t.co/OeFMvn7lMX"
1330116883316609031,2020-11-21 11:52:32,"देश के नौजवान सौ साल पहले के उस कालखंड को याद करें। 1920 में जो आपकी उम्र का था, उसके सपने क्या थे, जज्बा क्या था?… https://t.co/alE7JMzucW"
1330116810742657029,2020-11-21 11:52:14,"जब पूरी दुनिया इतने बड़े संकट से जूझ रही है, ऐसे समय में ग्रेजुएट होना आसान बात नहीं है।
 
लेकिन आपकी ताकत और क्षम… https://t.co/cQZ8X5P4pT"
1330116528449216513,2020-11-21 11:51:07,"Interacting with students of PDPU is special. 

This is a University I have had the honour of being closely associa… https://t.co/6Nw7nIum5q"
1330024224761659392,2020-11-21 05:44:20,Addressing the students of PDPU during their Convocation. https://t.co/TI34n8PykZ
1329814734258855937,2020-11-20 15:51:54,"Reviewed various issues like prioritisation of population groups, reaching out to HCWs, cold-chain Infrastructure a… https://t.co/O4Kd6XAXyl"
1329814674376802305,2020-11-20 15:51:39,Held a meeting to review India’s vaccination strategy and the way forward. Important issues related to progress of… https://t.co/mTRgudb9He
1329791544665153537,2020-11-20 14:19:45,"At 11 AM tomorrow, 21st November, I would be addressing the Convocation of PDPU, Gandhinagar. Will also be inaugura… https://t.co/4qPOtWLJxR"
1329742831586406405,2020-11-20 11:06:11,सूर्य की आराधना के महापर्व छठ की समस्त देशवासियों को बहुत-बहुत मंगलकामनाएं। छठी मइया सभी के जीवन में सुख-समृद्धि और… https://t.co/vklGWeX74f
1329728388852903938,2020-11-20 10:08:47,"Our security forces have once again displayed utmost bravery and professionalism. Thanks to their alertness, they h… https://t.co/dSDW3SvuY4"
1329728143653965825,2020-11-20 10:07:49,Neutralising of 4 terrorists belonging to Pakistan-based terrorist organisation Jaish-e-Mohammed and the presence o… https://t.co/I29o77GxSU
1329662036901433344,2020-11-20 05:45:08,Boosting ties with Bhutan. https://t.co/LvRhjJNvoE
1329450778763927553,2020-11-19 15:45:40,Was pleased to hold the India-Luxembourg Summit with PM @Xavier_Bettel in virtual format today. We agreed on the po… https://t.co/cmnq9msb1x
1329386539701264385,2020-11-19 11:30:24,Speaking at the first ever India-Luxembourg bilateral summit with PM @Xavier_Bettel. https://t.co/xL3M2UJGCv
1329341861543067648,2020-11-19 08:32:52,Invigorating the defence sector with latest technology. https://t.co/GxKhLucICE
1329341807834980352,2020-11-19 08:32:39,The Government of India is working towards policy friendly measures for the IT industry. https://t.co/Xnjq4AAVxn
1329341762704265216,2020-11-19 08:32:28,The Information Era is different from the Industrial Era. The Information Era brings many opportunities that our yo… https://t.co/45qL2Tg3TI
1329341675265609728,2020-11-19 08:32:08,"The COVID-19 global pandemic has witnessed unparalleled tech adoption, be it at home, in style of work, healthcare… https://t.co/xGAOx39jXx"
1329341411280396288,2020-11-19 08:31:05,Digital India has played a pivotal role in transforming the lives of the poor and marginalised. https://t.co/krC6p4oO11
1329337150387601408,2020-11-19 08:14:09,"Over the past few days, I have been reading, 'A New Idea of India: Individual Rights in a Civilisational State’ by… https://t.co/sZO2OlC4NI"
1329310449322627074,2020-11-19 06:28:03,"On World Toilet Day, India strengthens its resolve of #Toilet4All. The last few years have seen an unparalleled ach… https://t.co/YOH8rqvG5H"
1329298743619772417,2020-11-19 05:41:32,Addressing the Bengaluru Tech Summit. https://t.co/OJ84I7DP1W
1329287103797190657,2020-11-19 04:55:17,"पूर्व प्रधानमंत्री इंदिरा गांधी जी को उनकी जयंती पर नमन।

Tributes to former PM Smt. Indira Gandhi Ji on her birth anniversary."
1329286225069568006,2020-11-19 04:51:47,आजादी की पहली लड़ाई में अद्भुत पराक्रम का परिचय देने वाली वीरांगना रानी लक्ष्मीबाई को उनकी जयंती पर कोटि-कोटि नमन।… https://t.co/vuHu0PMAg1
1329084784044249089,2020-11-18 15:31:20,"Will be addressing the Bengaluru Tech Summit at 11 AM tomorrow, 19th November. Looking forward to interacting with… https://t.co/pzkS4LsYfK"
1329016785899753472,2020-11-18 11:01:08,"Smt. Mridula Sinha Ji will be remembered for her efforts towards public service. She was also a proficient writer,… https://t.co/21gsRwVApn"
1328927516661223424,2020-11-18 05:06:24,Saddened by the accident in Vadodara. My thoughts are with those who lost their loved ones. Praying that the injure… https://t.co/ONEHcTtZIq
1328909294318718978,2020-11-18 03:54:00,"India offers investors exactly what they need...

Come, invest in India. https://t.co/r7Cb455sid"
1328909190128037888,2020-11-18 03:53:35,"The need of the hour:

Affordable housing. 

Sustainable mobility. https://t.co/K8jQicm0j0"
1328909074067464198,2020-11-18 03:53:07,One of the areas that requires global attention in the post-COVID era is ensuring urban rejuvenation. https://t.co/rvuM17BN6a
1328761973140439041,2020-11-17 18:08:36,I also conveyed warm congratulations for VP-elect @KamalaHarris. Her success is a matter of great pride and inspira… https://t.co/6R0TnJycRk
1328761821302464517,2020-11-17 18:08:00,Spoke to US President-elect @JoeBiden on phone to congratulate him. We reiterated our firm commitment to the Indo-U… https://t.co/Pp1m2sq77K
1328687492212477952,2020-11-17 13:12:38,Addressing 3rd Annual Bloomberg New Economy Forum. https://t.co/QnSW1pzpNf
1328680525872041984,2020-11-17 12:44:57,My intervention during the BRICS Summit. https://t.co/amMz0bw1ro
1328659980031913986,2020-11-17 11:23:19,Speaking at the BRICS Summit. https://t.co/e2X66cZ5so
1328606989916704769,2020-11-17 07:52:45,This month’s #MannKiBaat is on the 29th. I have already received many interesting inputs and anecdotes about inspir… https://t.co/7xFEoYYeZB
1328606987588952064,2020-11-17 07:52:44,"Every #MannKiBaat we celebrate the accomplishments of outstanding people, working for societal good. But, for every… https://t.co/TJOv9h7PbN"
1328308215314976774,2020-11-16 12:05:31,Congratulations to @NitishKumar Ji on taking oath as Bihar’s CM. I also congratulate all those who took oath as Min… https://t.co/gZaBOdy2bs
1328283232291307521,2020-11-16 10:26:15,"कोरोना महामारी का कठिन समय हमारे सेवाभाव और हमारी एकजुटता के लिए कसौटी की तरह रहा है, लेकिन मुझे संतोष है कि देश इस… https://t.co/umIX5wo4YQ"
1328283197394747393,2020-11-16 10:26:07,"सेवा, शिक्षा और आत्मनिर्भरता, ये विषय आचार्य विजयवल्लभ जी के हृदय के सबसे करीब थे।
 
उनके इसी सामाजिक दर्शन से प्रे… https://t.co/3wLnydh9TO"
1328283133943312384,2020-11-16 10:25:52,"भारत ने हमेशा पूरे विश्व और मानवता को शांति, अहिंसा एवं बंधुत्व का मार्ग दिखाया है। इसी मार्गदर्शन के लिए दुनिया आज… https://t.co/Qama6OPIMw"
1328268617163522049,2020-11-16 09:28:11,"जिस प्रकार आजादी के आंदोलन की पीठिका भक्ति आंदोलन से शुरू हुई, वैसे ही आत्मनिर्भर भारत की पीठिका हमारे संत-महंत-आचा… https://t.co/N7FOFUXvCI"
1328235430001614849,2020-11-16 07:16:18,A tribute to Jainacharya Shree Vijay Vallabh Surishwer Ji Maharaj. https://t.co/3I8Jzc1Mud
1328165043523842050,2020-11-16 02:36:37,"At 12:30 today afternoon, will unveil the ‘Statue of Peace’ to mark the 151st Jayanti celebrations of Jainacharya S… https://t.co/4SETsx2MTu"
1328164687301644290,2020-11-16 02:35:12,भाई दूज के पावन अवसर पर आप सभी को बहुत-बहुत शुभकामनाएं।
1328164211713708033,2020-11-16 02:33:18,"નૂતન વર્ષાભિનંદન.....
સૌ ગુજરાતી બહેનો-ભાઈઓને નવા વર્ષની હૃદયપૂર્વકની શુભકામનાઓ. આપ સર્વને નવા વર્ષે સ્વાસ્થ્ય, સમૃ… https://t.co/HaWApC6hlW"
1328035806359871488,2020-11-15 18:03:04,प्रो. रवींद्र नागर जी के निधन के समाचार से अत्यंत दुख हुआ है। संस्कृत भाषा के प्रचार-प्रसार और उसे लोकप्रिय बनाने… https://t.co/gSQ9U0msWz
1327901692470280192,2020-11-15 09:10:09,श्री सौमित्र चटर्जी का निधन विश्व सिनेमा के साथ-साथ पश्चिम बंगाल और पूरे देश के सांस्कृतिक जीवन के लिए बहुत बड़ी… https://t.co/2XfHBIQkWi
1327901586086006786,2020-11-15 09:09:43,"শ্রী সৌমিত্র চট্টোপাধায়ের প্রয়াণ চলচ্চিত্র জগত, পশ্চিমবঙ্গ সহ ভারতের সাংস্কৃতিক পরিমন্ডলে এক অপূরণীয় ক্ষতি। তাঁর… https://t.co/l8qEa8tuV1"
1327901549142556679,2020-11-15 09:09:35,"Shri Soumitra Chatterjee’s death is a colossal loss to the world of cinema, cultural life of West Bengal and India.… https://t.co/UEIvwpMOTe"
1327817229354688518,2020-11-15 03:34:31,"भगवान बिरसा मुंडा जी को उनकी जयंती पर शत-शत नमन। वे गरीबों के सच्चे मसीहा थे, जिन्होंने शोषित और वंचित वर्ग के क… https://t.co/qbNifpHY0j"
1327816806862503937,2020-11-15 03:32:51,झारखंड के स्थापना दिवस पर राज्य के सभी निवासियों को मेरी हार्दिक शुभकामनाएं। इस अवसर पर मैं यहां के सभी लोगों के सु… https://t.co/k7SVn2aa5d
1327607567216873473,2020-11-14 13:41:24,Shri Kailash Sarang Ji made stupendous efforts to strengthen the BJP across Madhya Pradesh. He will be remembered a… https://t.co/gg1cwBQEsj
1327576482512728064,2020-11-14 11:37:53,Some more glimpses from Longewala earlier today. https://t.co/aZQaRHTlxi
1327575766201077762,2020-11-14 11:35:02,"Laid a wreath at the war memorial at Longewala, Rajasthan. https://t.co/ULt7estyb2"
1327574526138335237,2020-11-14 11:30:06,It is important that the coming generations know about the bravery with which our soldiers and security forces ensu… https://t.co/rdMeyy68tZ
1327573943994073088,2020-11-14 11:27:48,Interacted with our air warriors and brave soldiers and security personnel at Jaisalmer. https://t.co/oZA9ivar2p
1327573498873561090,2020-11-14 11:26:01,"Every year, I cherish spending Diwali with our security forces. It is a way of reaffirming our solidarity with them… https://t.co/ZkX1xvny8W"
1327572079055659008,2020-11-14 11:20:23,"RT @narendramodi_in: May the sacred occasion of Deepavali bring positivity and brightness to everyone’s life. 

Send special Deepavali gree…"
1327553979006521345,2020-11-14 10:08:28,"हर बार, हर त्योहार में, जब भी मैं आपके बीच आता हूं,

जितना समय आपके बीच बिताता हूं,

जितना आपके सुख-दुख में शामिल… https://t.co/FLfAm1pidE"
1327553907673980928,2020-11-14 10:08:11,"सीमा पर रहकर आप जो त्याग करते हैं, तपस्या करते हैं, वह देश में एक विश्वास पैदा करता है।

यह विश्वास होता है कि बड़ी… https://t.co/7Ffv7MKHSs"
1327553817521643521,2020-11-14 10:07:49,"देश की अखंडता देशवासियों की एकता पर निर्भर करती है।

सीमा की सुरक्षा सुरक्षाबलों की शक्ति के साथ जुड़ी है।

सीमा पर… https://t.co/qRMffubxVZ"
1327553738228322305,2020-11-14 10:07:30,"आज पूरा विश्व विस्तारवादी ताकतों से परेशान है। 

विस्तारवाद एक तरह से मानसिक विकृति है और 18वीं सदी की सोच को दर्शा… https://t.co/vdKY8usaT5"
1327553646960238593,2020-11-14 10:07:08,"सतर्कता ही सुरक्षा की राह है, 
सजगता ही सुख-चैन का संबल है।
सामर्थ्य ही विजय का विश्वास है, 
सक्षमता से ही शांति का… https://t.co/YIhtU5YnRF"
1327553555557986304,2020-11-14 10:06:47,"परिस्थिति कैसी भी हो, आपका पराक्रम और शौर्य अतुलनीय है।

आपके इसी शौर्य को नमन करते हुए 130 करोड़ देशवासी आपके साथ… https://t.co/t90Tb3Pvj8"
1327553430269943810,2020-11-14 10:06:17,"जब भी सैन्य कुशलता के इतिहास के बारे में लिखा-पढ़ा जाएगा, तो बैटल ऑफ लोंगेवाला को जरूर याद किया जाएगा।

यहां की पो… https://t.co/96aeoS2uHx"
1327553312850403328,2020-11-14 10:05:49,"जब मैं 2014 में दिवाली पर सियाचिन गया था, तो कुछ लोग चौंक गए थे।

दिवाली पर अपनों के बीच ही तो आऊंगा, अपनों से दूर… https://t.co/1xejM3FwdE"
1327491076123287553,2020-11-14 05:58:30,"India is proud of our forces, who protect our nation courageously. https://t.co/3VyP0WusDf"
1327415898345410561,2020-11-14 00:59:47,देश के प्रथम प्रधानमंत्री पं. जवाहर लाल नेहरू को उनकी जयंती पर मेरी विनम्र श्रद्धांजलि।
1327415543616348165,2020-11-14 00:58:22,"सभी देशवासियों को दीपावली की हार्दिक मंगलकामनाएं।

Wishing everyone a Happy Diwali! May this festival further brigh… https://t.co/4s9gq7zKWU"
1327225291668852736,2020-11-13 12:22:22,"This Diwali, let us also light a Diya as a #Salute2Soldiers who fearlessly protect our nation. Words can’t do justi… https://t.co/1Aylos0mRJ"
1327126352143790080,2020-11-13 05:49:13,Furthering the popularity of Ayurveda in India. #AyurvedaDay https://t.co/iuiADCnqsY
1327058348311674881,2020-11-13 01:19:00,"धनतेरस की आप सभी को बहुत-बहुत बधाई। भगवान धन्वंतरि हर किसी के जीवन में सुख, समृद्धि, सौभाग्य और उत्तम स्वास्थ्य लेकर आएं।"
1326930797530673163,2020-11-12 16:52:09,Congratulations to Daw Aung San Suu Kyi &amp; NLD for victory in the elections. The successful conduct of polls is anot… https://t.co/imf17SVGVy
1326908917360816129,2020-11-12 15:25:13,"आज हर कोई अपनी विचारधारा पर गर्व करता है। यह स्वाभाविक भी है। 
 
लेकिन हमारी विचारधारा राष्ट्रहित के विषयों में रा… https://t.co/5Z0nIZqwFK"
1326908852026085380,2020-11-12 15:24:57,"नई National Education Policy की Core Values हैं- Confidence, Conviction और Character से भरे युवा भारत का निर्माण कर… https://t.co/8KnSceW75S"
1326908760648986626,2020-11-12 15:24:35,"आज सिस्टम में जितने रिफॉर्म्स किए जा रहे हैं, उनके पीछे भारत को हर प्रकार से बेहतर बनाने का संकल्प है।
 
आज हो रहे… https://t.co/vQyhw7cUfR"
1326908693292732417,2020-11-12 15:24:19,"देश के युवा दुनियाभर में Brand India के Brand Ambassadors हैं।
 
हमारे युवा भारत के Culture और Traditions का प्रति… https://t.co/gUIMQ9XMWN"
1326908648925376512,2020-11-12 15:24:09,स्वामी विवेकानंद जी कहते थे- “मूर्ति में आस्था का रहस्य यह है कि आप उस एक चीज से ‘Vision of Divinity’ डेवलप करते… https://t.co/iEi3N3zfiA
1326901097026506752,2020-11-12 14:54:08,Today’s Aatmanirbhar Bharat Package continues our efforts to help all sections of society. These initiatives will h… https://t.co/JlGUxyOTDO
1326875844329889792,2020-11-12 13:13:48,Matter of immense pride that a Swami Vivekananda statue is being unveiled in JNU. https://t.co/OvXTVpPWMe
1326864147338850305,2020-11-12 12:27:19,ગુજરાત સરકારના ભુતપૂર્વ મંત્રી શ્રી સુંદરસિંહ ચૌહાણના અવસાનથી દુ:ખ અનુભવું છું. સદ્દગતના આત્માની શાંતિ માટે પ્રાર્થ… https://t.co/kHSjL1lTlZ
1326840647760846848,2020-11-12 10:53:56,Speaking at the 17th ASEAN-India Summit. https://t.co/z87EjxG93l
1326735652554231808,2020-11-12 03:56:43,"At 6:30 this evening, will unveil a statue of Swami Vivekananda at the JNU campus and share my thoughts on the occa… https://t.co/n4zzDeba5l"
1326564960684679171,2020-11-11 16:38:27,Had an excellent conversation with DG of @WHO @DrTedros. We discussed the vast potential of traditional medicine fo… https://t.co/7OEpTR4jWd
1326563749071904769,2020-11-11 16:33:38,"जिनके दिल में राष्ट्रहित सर्वोपरि है, जिनमें लोकतंत्र के लिए प्रतिबद्धता है, ऐसे युवाओं से मेरा आह्वान है कि वो आगे… https://t.co/dqcAjeo3JX"
1326563595929473026,2020-11-11 16:33:02,21वीं सदी का भारत एक नए मिजाज का भारत है। न हमें आपदाएं रोक सकती हैं और न ही बड़ी-बड़ी चुनौतियां। मैं एक नए भारत के… https://t.co/XMtF3c5eiQ
1326563502513942528,2020-11-11 16:32:40,"अगर आज आप मुझे बिहार के चुनाव नतीजों के बारे में पूछेंगे तो मेरा जवाब भी जनता के जनादेश की तरह साफ है-
 
बिहार में… https://t.co/DZpFHI6RH5"
1326563404715323394,2020-11-11 16:32:16,"भाजपा सरकारों की पहचान ही है - गुड गवर्नेंस।
 
गुड गवर्नेंस से कैसे स्थितियां बदल जाती हैं, बड़ी से बड़ी आपदाओं का… https://t.co/tqmRw51omE"
1326563317666766850,2020-11-11 16:31:55,"आज भाजपा ही देश की एकमात्र राष्ट्रीय पार्टी है, 
 
जिसमें गरीब, दलित, पीड़ित, शोषित, वंचित अपना भविष्य देखते हैं।… https://t.co/sMOQ5dX8oe"
