id,created_at,text
1400482640621301766,2021-06-03 16:00:55,"We also discussed ongoing efforts to further strengthen India-US vaccine cooperation, and the potential of our part… https://t.co/YuGrDugNHR"
1400482638876405764,2021-06-03 16:00:55,Spoke to @VP Kamala Harris a short while ago. I deeply appreciate the assurance of vaccine supplies to India as par… https://t.co/r3kiqDseTG
1400417670294552576,2021-06-03 11:42:45,"Earlier today, reviewed India’s Olympic preparations for the upcoming Tokyo games. Discussed the steps taken for su… https://t.co/Bs3mEURGuV"
1400139733666205704,2021-06-02 17:18:20,"The decision on Class XII exams was taken after an extensive consultive process.

We got several inputs from all ov… https://t.co/y2xrFIq7uJ"
1400139590556479489,2021-06-02 17:17:46,"It has been a chaotic year for students. The joys of growing up partly snatched away, confined to their homes, less… https://t.co/OLVnhh1G47"
1400139288012943361,2021-06-02 17:16:34,The teaching community has played an outstanding role in the last year. I would like to applaud all the teachers fo… https://t.co/0bDZPpNhEC
1400139132580466689,2021-06-02 17:15:57,Health and welfare of students is our topmost priority! https://t.co/q7QsipiDF5
1399930257029828609,2021-06-02 03:25:57,Best wishes to the people of Telangana on the state’s Formation Day. The state is blessed with a unique culture and… https://t.co/WlOGHhh6iD
1399729887020126212,2021-06-01 14:09:45,"Government of India has decided to cancel the Class XII CBSE Board Exams. After extensive consultations, we have ta… https://t.co/BOorw7c0YG"
1398967854225973251,2021-05-30 11:41:42,"हमारे यहां कहते हैं कि बेटी जब बोलती है, तो उसके शब्दों में सरस्वती विराजमान होती है और जब अदिति बोल रही है कि हम ज… https://t.co/0Ga5OYlps7"
1398966637999497217,2021-05-30 11:36:52,Greetings to the people of Goa on their Statehood Day. May the state scale new heights of progress. I pray for the… https://t.co/JU274jX1o7
1398927202717212677,2021-05-30 09:00:10,"Sharing a compilation of the pro-people measures undertaken in the last seven years. #7YearsofSeva 

https://t.co/pVEuuZmlqR"
1398927017547112450,2021-05-30 08:59:26,"पिछले 7 सालों में हमने सरकार और जनता से ज्यादा एक देश के रूप में काम किया, एक टीम के रूप में काम किया, ‘Team India’… https://t.co/wOBdc2vTwk"
1398926835623268353,2021-05-30 08:58:43,कोरोना के खिलाफ लड़ाई में बहुत बड़ी भूमिका देश के कई क्षेत्रों के अनेक वॉरियर्स की भी है। क्या आपको पता है कि इस म… https://t.co/6Ki2KPK0jN
1398926714475102209,2021-05-30 08:58:14,"At a time when everybody wants to run away from Coronavirus, our lab technicians do not have that luxury. In the la… https://t.co/VyfH9J0OQ2"
1398926288212172800,2021-05-30 08:56:32,"Our Nari Shakti is at the forefront of helping others.

Sireesha Ji is a loco pilot who has operated an all-woman O… https://t.co/VhijQ9K3fa"
1398925898640994306,2021-05-30 08:54:59,"Group Captain Patnaik, like several other colleagues of the Air Force, has been busy with sorties to boost oxygen s… https://t.co/Cf1Vyjr49l"
1398925696857260035,2021-05-30 08:54:11,"Dinesh Upadhyay Ji belongs to Jaunpur, UP. He has been driving a truck for years but in the time of COVID-19 he has… https://t.co/Cv4ew9JrIY"
1398874407951495169,2021-05-30 05:30:23,#MannKiBaat May 2021. Tune in. https://t.co/Yx0U7QzZ3l
1398648453337583620,2021-05-29 14:32:31,Family Pension under ESIC and EPFO- Employees’ Deposit Linked Insurance Scheme will provide a financial cushion to… https://t.co/NRnSypGsKk
1398630525435265032,2021-05-29 13:21:17,"Supporting our nation’s future!

Several children lost their parents due to COVID-19. The Government will care for… https://t.co/7Iwx1NSGEz"
1398468773158424579,2021-05-29 02:38:32,Had a very productive review meeting in Bhubaneswar. We will continue working together to strengthen disaster manag… https://t.co/NQycungluA
1398300571556319237,2021-05-28 15:30:10,"કચ્છ જે મહારાવો શ્રી પ્રાગમલજી (ત્ર્યા) જે મરણ થી દુ:ખ અનુભવીયાતો, સદ્ગત જી આત્માજી શાંતી લાય અંતર મનસે અરદાસ્ત કરી… https://t.co/aoA21HnTl0"
1398237296399290376,2021-05-28 11:18:44,"কেন্দ্রীয় সরকার পশ্চিমবঙ্গের বোন ও ভাইদের সঙ্গে একাত্মতা প্রকাশ করছে। ঘূর্ণিঝড় ইয়াসের ফলে যে ক্ষতি হয়েছে, তার জ… https://t.co/fdWz1kK7ZG"
1398237143885963265,2021-05-28 11:18:07,ଓଡ଼ିଶାର ଜନସାଧାରଣଙ୍କ ସହିତ କେନ୍ଦ୍ର ସରକାର ଦୃଢ଼ତାର ସହିତ ଅଛନ୍ତି । ବାତ୍ୟା ୟଶ୍ ପରିସ୍ଥିତିର ସମୀକ୍ଷା କଲି । ବର୍ତ୍ତମାନ ଚାଲୁଥିବା… https://t.co/PzAImrs08H
1398235859757932544,2021-05-28 11:13:01,Took stock of the damage caused by Cyclone Yaas. Undertook an aerial survey across parts of Odisha and West Bengal.… https://t.co/Ub1E5HhEcC
1398098921759510529,2021-05-28 02:08:53,आजादी की लड़ाई के महान सेनानी और प्रखर राष्ट्रभक्त वीर सावरकर को उनकी जयंती पर कोटि-कोटि नमन।
1397867400599531523,2021-05-27 10:48:54,"Reviewed the situation arising due to Cyclone Yaas. Discussed the preparedness, relief and rehabilitation efforts a… https://t.co/NA0GH03a3w"
1397867220303159297,2021-05-27 10:48:11,"Took stock of the progress of the National Digital Health Mission, a futuristic endeavour that will ensure a range… https://t.co/PIDzWawJDy"
1397578792994971655,2021-05-26 15:42:04,Spoke to my dear friend President @EmmanuelMacron. I thanked him for France’s prompt assistance to India’s COVID-19… https://t.co/BGF1pGN0aw
1397407944430391299,2021-05-26 04:23:11,"Speaking at the Vesak Day programme. 

We remember the noble ideals of Lord Buddha. https://t.co/JMmup8Mvtm"
1396459262549839877,2021-05-23 13:33:27,"Dr. Srikumar Banerjee will be remembered for his pioneering contributions to Indian science, especially in the area… https://t.co/2araHiCV7P"
1396405822725386245,2021-05-23 10:01:06,"ଉପଯୁକ୍ତ ସମୟରେ ସ୍ଥାନାନ୍ତରଣ, ବିଜୁଳି ଓ ଯୋଗାଯୋଗ ବ୍ୟବସ୍ଥା ଯେପରି ବିଚ୍ଛିନ୍ନ ନହୁଏ ସେଥିପାଇଁ ଗୁରୁତ୍ୱାରୋପ କଲି । ଯେପରି ବାତ୍ୟା… https://t.co/XTK50iJDpS"
1396405820783349761,2021-05-23 10:01:06,ବାତ୍ୟା ୟଶ୍ ର ମୁକାବିଲା ପ୍ରସ୍ତୁତିର ସମୀକ୍ଷା କଲି । ପ୍ରଭାବିତ ଅଞ୍ଚଳ ଗୁଡିକରେ ଲୋକଙ୍କୁ ସହାୟତା ଯୋଗାଇ ଦେବାପାଇଁ ବିଭିନ୍ନ ଉଦ୍ୟମ ସ… https://t.co/hJ4RNblePn
1396405649823522821,2021-05-23 10:00:25,সকলের নিরাপত্তা ও কল্যাণ কামনা করি ।
1396405645939601413,2021-05-23 10:00:24,"নিরাপদ জায়গায় মানুষকে দ্রুত সরিয়ে নিয়ে যাওয়া, বিদ্যুৎ ও যোগাযোগ ব্যবস্থা যাতে বিঘ্নিত না হয় তা নিশ্চিত করার উ… https://t.co/ElCgbShJvW"
1396405643502776326,2021-05-23 10:00:24,ঘূর্ণিঝড় ইয়াসের ফলে সম্ভাব্য পরিস্থিতি মোকাবিলার প্রস্তুতি পর্যালোচনা করা হয়েছে। প্রভাবিত এলাকার বাসিন্দাদের সা… https://t.co/avUfZMKeWU
1396379128778080260,2021-05-23 08:15:02,Emphasised on timely evacuation as well as ensuring power and communications networks are not disrupted. Also empha… https://t.co/8yw7vcmr5w
1396379125779030018,2021-05-23 08:15:01,"Reviewed the preparedness to tackle Cyclone Yaas. 

Was briefed on the various efforts to assist people living in t… https://t.co/8MYYz3HPLf"
1396044750613057540,2021-05-22 10:06:20,संस्कृत की महान विभूति महामहोपाध्याय पं. रेवा प्रसाद द्विवेदी जी के निधन से अत्यंत दुख पहुंचा है। उन्होंने साहित्य… https://t.co/GVBwss6v5i
1395668613453914113,2021-05-21 09:11:42,"हमें अभी एक लंबी लड़ाई लड़नी है। बनारस और पूर्वांचल के ग्रामीण इलाकों पर भी बहुत ध्यान देना है।

‘जहां बीमार वहीं उ… https://t.co/EtA6Fiatkx"
1395668397908631552,2021-05-21 09:10:50,"बनारस ने जिस स्पीड से इतने कम समय में ऑक्सीजन और आईसीयू बेड्स की संख्या कई गुना बढ़ाई है, जिस तरह से इतनी जल्दी पं… https://t.co/6XTjEwYHK8"
1395668280275206150,2021-05-21 09:10:22,"कोरोना ने हमसे कई अपनों को छीना है। मैं उन सभी लोगों को अपनी श्रद्धांजलि देता हूं, उनके परिजनों के प्रति सांत्वना… https://t.co/scfLkpmHK4"
1395650299046543367,2021-05-21 07:58:55,Passing away of Shri Sunderlal Bahuguna Ji is a monumental loss for our nation. He manifested our centuries old eth… https://t.co/6JRFLRiPFt
1395626377949315074,2021-05-21 06:23:52,Reviewing COVID-19 situation in Kashi with doctors and frontline workers working there. https://t.co/eIg562g009
1395404967448559635,2021-05-20 15:44:04,"At 11 AM tomorrow, 21st May, will be interacting with doctors and frontline workers who are working tirelessly to c… https://t.co/3JowxAhDVr"
1395334552910958598,2021-05-20 11:04:16,Congratulations to Shri @vijayanpinarayi Ji on taking oath as CM and commencing his second term in office.
1395334279903731713,2021-05-20 11:03:11,"Earlier today, had an extensive interaction with District Officers from various states. These officers are tireless… https://t.co/D6stgwDWyF"
1395271669673984003,2021-05-20 06:54:23,"Interaction with District Officials on the COVID-19 situation.
 https://t.co/k2RtKzIFHY"
1395213672914509824,2021-05-20 03:03:56,"Saddened by the demise of former Rajasthan CM, Shri Jagannath Pahadia Ji. In his long political and administrative… https://t.co/HAu1vFncTH"
1395024916236406786,2021-05-19 14:33:52,सरकार किसानों के जीवन को बेहतर बनाने के लिए प्रतिबद्ध है। इसलिए अंतरराष्ट्रीय मूल्यों में बढ़ोतरी के बावजूद हमने उ… https://t.co/8SYdp5TsJb
1394974419974508544,2021-05-19 11:13:13,Ex-gratia of Rs. 2 lakh would be given to the next of kin of those who lost their lives due to Cyclone Tauktae in a… https://t.co/caofsDCgfM
1394974148124885001,2021-05-19 11:12:08,Reviewed the situation caused by Cyclone Tauktae during a meeting in Ahmedabad. Took stock of the evacuation effort… https://t.co/K5wUj04tjd
1394947572762955778,2021-05-19 09:26:32,Undertook an aerial survey over parts of Gujarat and Diu to assess the situation in the wake of Cyclone Tauktae. Ce… https://t.co/xol4vaGnsS
1394712864296824833,2021-05-18 17:53:54,भाजपा नेता और उत्तर प्रदेश सरकार में मंत्री विजय कश्यप जी के निधन से अत्यंत दुख हुआ है। वे जमीन से जुड़े नेता थे और… https://t.co/63uNTBPEuo
1394616277352665091,2021-05-18 11:30:05,Interacted with District Officials on ways to overcome COVID-19. They shared their experiences from districts. I sp… https://t.co/8H4SHgLay6
1394560952650043396,2021-05-18 07:50:15,Shri Chaman Lal Gupta Ji will be remembered for numerous community service efforts. He was a dedicated legislator a… https://t.co/M7OKOrW9Qq
1394549185349783552,2021-05-18 07:03:29,Interacting with District Officials on the COVID-19 situation. https://t.co/Yy4w15sZYB
1394292538064916480,2021-05-17 14:03:40,"Interacted with doctors across India. They shared insightful inputs, based on their own experiences of curing COVID… https://t.co/rCD8W8yLYs"
1393812701852303360,2021-05-16 06:16:58,Statehood Day greetings to the people of Sikkim. This state is blessed with rich natural beauty and is home to warm… https://t.co/RYxkmm1m3I
1393812477922607109,2021-05-16 06:16:05,"Professor M. S. Narasimhan will be remembered as an exemplary mathematician, who made a phenomenal impact worldwide… https://t.co/vD4jG8nuks"
1393807608025272323,2021-05-16 05:56:44,"Anguished by the passing away of my friend from Parliament, Shri Rajeev Satav Ji. He was an upcoming leader with mu… https://t.co/NYLAenpRFM"
1393627867947307009,2021-05-15 18:02:30,Giani Joginder Singh Vedanti Ji was scholarly and humble. His life was a manifestation of selfless human service. H… https://t.co/VZAzbbk1Cl
1393617100376133634,2021-05-15 17:19:43,"You left us too soon, Sunil Jain. I will miss reading your columns and hearing your frank as well as insightful vie… https://t.co/p7H5iAoeVw"
1393567536155750403,2021-05-15 14:02:46,"Reviewed preparedness on Cyclone Tauktae including ensuring essential supplies, continuing the COVID-19 fight and m… https://t.co/8abriILOHP"
1393493494824456192,2021-05-15 09:08:33,"Discussed a number of issues during today’s review meeting on COVID-19, including scaling up testing in areas with… https://t.co/jyft5Wv1lx"
1393143921761341441,2021-05-14 09:59:28,"कोरोना से बचाव का एक बहुत बड़ा माध्यम है, इसका टीका। इसलिए जब भी आपकी बारी आए तो टीका जरूर लगवाएं। यह टीका कोरोना… https://t.co/78fZPfF4k1"
1393143844435161091,2021-05-14 09:59:10,"बीते कुछ समय से जो कष्ट देशवासियों ने सहा है, उसे मैं भी उतना ही महसूस कर रहा हूं। देश का प्रधान सेवक होने के नाते,… https://t.co/5NDNkvP8LF"
1393143766458920961,2021-05-14 09:58:51,"पीएम किसान सम्मान निधि की राशि आज के कठिन समय में किसान परिवारों के बहुत काम आ रही है।

जरूरत के समय देशवासियों तक… https://t.co/8XU8o6b3rQ"
1393080692905414657,2021-05-14 05:48:14,8th instalment under #PMKisan is being released. Watch. https://t.co/aTcCrilMKE
1393051701297307656,2021-05-14 03:53:01,"On the special occasion of Basava Jayanthi, I bow to Jagadguru Basaveshwara. His noble teachings, particularly the… https://t.co/7R8M7cYtza"
1393030554761658369,2021-05-14 02:29:00,भगवान परशुराम की जयंती के पावन अवसर पर सभी देशवासियों को शुभकामनाएं।
1393030498272768001,2021-05-14 02:28:46,सभी देशवासियों को अक्षय तृतीया की मंगलकामनाएं। शुभ कार्यों की सिद्धि से जुड़ा यह पावन पर्व कोरोना महामारी पर विजय… https://t.co/rDZd4HbGCe
1393029211149852673,2021-05-14 02:23:39,Best wishes on the auspicious occasion of Eid-ul-Fitr. Praying for everyone’s good health and well-being. Powered b… https://t.co/cgKi2uR3E1
1392894218889138176,2021-05-13 17:27:15,Saddened by the demise of Times Group Chairperson Smt. Indu Jain Ji. She will be remembered for her community servi… https://t.co/JwOBBuUXWy
1392886954044231681,2021-05-13 16:58:23,"Saddened by the demise of Prof. S Tiken Singh, President of @BJP4Manipur. He will be remembered as a hardworking Ka… https://t.co/0F4OTMFwlc"
1392851591573671945,2021-05-13 14:37:52,ગુજરાતના એક સેવાભાવી શ્રેષ્ઠી શ્રી કાન્તિસેન શ્રોફ (કાકા)ના નિધનથી અત્યંત દુ:ખ થયું. એક સફળ ઉદ્યોગપતિ હોવા ઉપરાંત… https://t.co/6OCeVTpyof
1392774184481161216,2021-05-13 09:30:16,देश के करोड़ों अन्नदाताओं के लिए कल का दिन बेहद महत्वपूर्ण है। सुबह 11 बजे वीडियो कॉन्फ्रेंसिंग के जरिए प्रधानमं… https://t.co/JeVxNh2Rb1
1392507730376544258,2021-05-12 15:51:29,Reviewed different aspects relating to the COVID-19 situation. This includes different sources of oxygen availabili… https://t.co/DJwHIEykck
1392469411991199752,2021-05-12 13:19:13,"Through PM-CARES, 1.5 lakh units of Oxycare Systems will be procured. This is a system developed by DRDO and has se… https://t.co/7P9y9nZKTD"
1392378451382792194,2021-05-12 07:17:46,অসমীয়া সাহিত্য আৰু সাংবাদিকতাৰ ক্ষেত্ৰখনলৈ আগবঢ়োৱা  অৱদানৰ বাবে শ্ৰী হোমেন বৰগোহাঞি স্মৰণীয় হৈ ৰ'ব। তেওঁৰ কৰ্মৰা… https://t.co/JfWbmjVSJQ
1392372815064489984,2021-05-12 06:55:22,Shri Homen Borgohain will be remembered for his rich contributions to Assamese literature and journalism. His works… https://t.co/wqb6531Xnn
1392365176872001539,2021-05-12 06:25:01,"International Nurses Day is a day to express gratitude to the hardworking nursing staff, who is at the forefront of… https://t.co/uGqnVvFnEg"
1392032291996639235,2021-05-11 08:22:15,"Discussed the pandemic situation with my friend Lyonchhen @PMBhutan, and conveyed appreciation for the solidarity a… https://t.co/4n5MpP31hJ"
1391992863089565700,2021-05-11 05:45:35,"In any challenging situation, our scientists and innovators have always risen to the occasion and worked to mitigat… https://t.co/lKgNM049bV"
1391992860812070913,2021-05-11 05:45:34,"On National Technology Day, we salute the hardwork and tenacity of our scientists and those passionate about techno… https://t.co/g48Q6ewSkH"
1391653854521937920,2021-05-10 07:18:29,My valued colleague @sarbanandsonwal Ji was at the helm of a pro-people and pro-development administration over the… https://t.co/80LCPQZrdZ
1391653752734588931,2021-05-10 07:18:04,Congratulations to @himantabiswa Ji and the other Ministers who took oath today. I am confident this team will add… https://t.co/IfTWA7sa91
1391382111249047553,2021-05-09 13:18:40,"ସାଂସଦ ରଘୁନାଥ  ମହାପାତ୍ରଙ୍କ ବିୟୋଗରେ ଦୁଃଖିତ। କଳା, ଭାସ୍କର୍ଯ୍ୟ ଓ ସଂସ୍କୃତି ଦୁନିଆକୁ ତାଙ୍କର ଅବଦାନ ଥିଲା ଅତୁଳନୀୟ। ପାରମ୍ପରିକ କ… https://t.co/H1s5mKDoCB"
1391377508549812225,2021-05-09 13:00:23,"Saddened by the demise of MP Shri Raghunath Mohapatra Ji. He made pioneering contributions to the world of art, arc… https://t.co/ZpPPkmSFuw"
1391286398150352897,2021-05-09 06:58:20,Saddened by the demise of INA veteran Lalti Ram Ji. His courage and contributions to India’s freedom struggle will… https://t.co/E5hKmAdkXW
1391242857575436288,2021-05-09 04:05:19,महान स्वतंत्रता सेनानी और समाजसेवी गोपाल कृष्ण गोखले को उनकी जयंती पर शत-शत नमन। राष्ट्रसेवा में समर्पित उनका जीवन… https://t.co/1FxxW1GcdD
1391242036309676041,2021-05-09 04:02:04,"अपने अप्रतिम साहस, शौर्य और युद्ध कौशल से मां भारती को गौरवान्वित करने वाले महान योद्धा महाराणा प्रताप को उनकी जयं… https://t.co/vhUhmS5yER"
1391241791270055937,2021-05-09 04:01:05,"On Tagore Jayanti, I bow to the great Gurudev Tagore. May his exemplary ideals keep giving us strength and inspirat… https://t.co/uln0JcczLX"
1391241156650881024,2021-05-09 03:58:34,"রবীন্দ্রজয়ন্তীতে গুরুদেব রবীন্দ্রনাথ ঠাকুরের প্রতি আমার প্রণাম। প্রার্থনা করি, তাঁর স্বপ্নের ভারতবর্ষ গড়ে তুলতে… https://t.co/iSXBOVey2p"
1391057011496783877,2021-05-08 15:46:50,I thank the leaders of EU and its Member States for their continued commitment to strengthening relationship with I… https://t.co/cCji2Rjqvf
1391057009240252418,2021-05-08 15:46:50,Our collaboration is essential to stopping the Covid-19 pandemic and ensuring a sustainable and inclusive recovery… https://t.co/n8yStFDETv
1391057006954389516,2021-05-08 15:46:49,Our stronger partnership is essential for achieving peace and prosperity for our peoples. We welcomed the resumptio… https://t.co/USafZWWyH5
1391057003384999944,2021-05-08 15:46:48,"Taking forward the commitment to transform India-EU relationship for global good, I had a virtual interaction with… https://t.co/ZnSmIL5OYQ"
1390958070033907715,2021-05-08 09:13:41,યોગગુરૂ સ્વામી અધ્યાત્માનંદજી પરમધામ સીધાવ્યા તે જાણી દુ:ખ થયું. આધ્યાત્મિકતા જેવા ગહન વિષયને તેઓએ સરળ શૈલીમાં સમજા… https://t.co/l9egYE1aaz
1390596531351339012,2021-05-07 09:17:03,Spoke with my friend @ScottMorrisonMP to thank him for Australia’s solidarity and support for India’s fight against… https://t.co/13ONkqaj1W
1390595451632504833,2021-05-07 09:12:46,I would like to congratulate Shri N.Rangasamy Ji on taking oath as Puducherry CM. Best wishes for the tenure ahead.
1390560236822429699,2021-05-07 06:52:50,Congratulations to Thiru @mkstalin on being sworn-in as Tamil Nadu Chief Minister.
1390533488487518209,2021-05-07 05:06:33,वरिष्ठ पत्रकार शेष नारायण सिंह जी का निधन अत्यंत दुखद है। पत्रकारिता जगत में अपने महत्वपूर्ण योगदान के लिए वे हमेशा… https://t.co/6oNobyNrco
1390278190858338305,2021-05-06 12:12:05,"'Jal', 'Thal' and 'Nabh'...our armed forces have left no stone unturned in strengthening the fight against COVID-19. https://t.co/JOcRRrhJgR"
1390273416641630212,2021-05-06 11:53:07,"RT @rajnathsingh: Fighting the Invisible Enemy: MoD’s Response on COVID-19 Surge

​Sensing the emergency situation, the whole Government ma…"
1390271779508146182,2021-05-06 11:46:36,ગુજરાતના પૂર્વ નાણામંત્રી શ્રી પ્રતાપભાઈ શાહના અવસાનના સમાચારથી વ્યથિત છું. ગુજરાતના જાહેર જીવન અને પત્રકારત્વ ક્ષે… https://t.co/jS8a05psbQ
1390244569845882883,2021-05-06 09:58:29,"Reviewed various aspects of the COVID-19 response in the states and districts, including the ongoing vaccination dr… https://t.co/Efi1NOKUFp"
1390153159641690113,2021-05-06 03:55:15,पूर्व केंद्रीय मंत्री चौधरी अजित सिंह जी के निधन से अत्यंत दुख हुआ है। वे हमेशा किसानों के हित में समर्पित रहे। उ… https://t.co/XcGc6vPDTE
1389932119753850881,2021-05-05 13:16:55,उत्तर प्रदेश भाजपा के सह-संगठन महामंत्री भवानी सिंह जी के निधन से अत्यंत दुख हुआ है। उन्होंने राज्य में भाजपा को मज… https://t.co/cVMghqpQ7K
