id,created_at,text
1306614555502501888,2020-09-17 15:22:40,इस कवितामयी भावपूर्ण संदेश के लिए आपका हृदय से आभार @yogrishiramdev जी। https://t.co/x6DouibZIm
1306614472719572992,2020-09-17 15:22:20,Thankful for your birthday wishes Kangana Ji. https://t.co/oTBRGlVJUh
1306609612192317440,2020-09-17 15:03:01,"Thank you @ScottMorrisonMP for your warm wishes. It is great to hear from a close friend! 

As two vibrant democrac… https://t.co/Sadm5ZB7kr"
1306609476171038721,2020-09-17 15:02:29,"Thank you, my friend, @BorisJohnson for your good wishes! 
India and the UK are bound by historical ties and a comm… https://t.co/tcB1HikIzC"
1306609304128991232,2020-09-17 15:01:48,"Thank you, Excellency @BoykoBorissov! 

Truly appreciate your greetings and warm sentiments. https://t.co/GBbUJAtpz5"
1306609170079051776,2020-09-17 15:01:16,"Many thanks for your warm wishes Pravind Jugnauth ji.  
India and Mauritius share a common civilisational ethos, wh… https://t.co/SvBbbnysIl"
1306608713780740098,2020-09-17 14:59:27,"Thank you, my dear friend Bibi @netanyahu!  It is always a special pleasure to receive your warm greetings and best… https://t.co/A7pGQuuzaw"
1306608564757098496,2020-09-17 14:58:52,"Thank you, my friend @KarzaiH, for your greetings. Truly appreciate your wishes. https://t.co/SHqe969AdO"
1306606462945259521,2020-09-17 14:50:30,Thank you for your birthday wishes and wishful thinking. :) https://t.co/cnit2tfVvD
1306606339121057792,2020-09-17 14:50:01,I look up to my fellow Indians for strength and inspiration. I want to do as much as possible for them. Thanks for… https://t.co/Do7pqxzr7n
1306606172477169665,2020-09-17 14:49:21,To serve our great nation and its talented people is an honour. Will continue the efforts to fulfil the dreams and… https://t.co/tgJKxWmrM5
1306606050330644481,2020-09-17 14:48:52,"Thanks!

Best wishes to you and your family in growing your kitchen garden. https://t.co/k7iEnwobCg"
1306605953198903296,2020-09-17 14:48:29,Thanks @iamsrk. I am sure the IPL season would be keeping you quite busy now on. https://t.co/d4vOKadSxR
1306605640735838208,2020-09-17 14:47:14,Delighted to receive your wishes. Was good seeing young Yug devoting his birthday towards a greener planet. Such aw… https://t.co/PiTQy5V7ln
1306604802466480128,2020-09-17 14:43:55,"Dear @aamir_khan, thank you. 🙏 https://t.co/DN7BsOH77W"
1306604605153787906,2020-09-17 14:43:08,Gratitude for the wishes @BeingSalmanKhan. Still recall our meeting during that Uttarayan. https://t.co/Pf0PFwfwTN
1306604129897254916,2020-09-17 14:41:14,Thank you and please convey my greetings to your brother Mukul. May he always remain happy and healthy. https://t.co/7xAvvD8khI
1306603794512244739,2020-09-17 14:39:54,Thank you. Hope your family is doing fine. https://t.co/6nkxLV6DM7
1306603075386314753,2020-09-17 14:37:03,Thanks for the greetings. https://t.co/BiGW23Ylbk
1306602819311398913,2020-09-17 14:36:02,Thank you @ActorMadhavan. How are you doing? https://t.co/NbUhhlRhtl
1306602743713259525,2020-09-17 14:35:44,Thanks @duttsanjay. I pray for your good health and wellbeing. https://t.co/uQPvOdm3Br
1306602603325698048,2020-09-17 14:35:10,Melodious...Wonderful effort! https://t.co/uIHPqX40QB
1306595035165515781,2020-09-17 14:05:06,शुभकामनाओं के लिए बहुत-बहुत धन्यवाद! https://t.co/T5xdi5JEad
1306593664815132675,2020-09-17 13:59:39,"Thanks a lot for your warm wishes, Biplab Ji. May Maa Tripurasundari keep blessing us all in our work towards Aatma… https://t.co/SsmytLwRvb"
1306593524108779521,2020-09-17 13:59:06,"Thanks for your wishes, @VNarayanasami Ji. https://t.co/vG3bDRrHeC"
1306593017185230854,2020-09-17 13:57:05,"Nothing as soothing as soulful music! 

Great effort by @mihirbhuta64, @nishithmehta, @burz_79 and you. 

This spec… https://t.co/ZkosEvgSha"
1306592840311472128,2020-09-17 13:56:23,"Thank you very much for your warm wishes, @Neiphiu_Rio Ji. https://t.co/neUF3zyFcl"
1306591356060532741,2020-09-17 13:50:29,"Thanks for the wishes, Biren Singh Ji. It’s also heartening to see street vendors being empowered. https://t.co/bIbbIrkHyS"
1306590957609971712,2020-09-17 13:48:54,Thanks for your touching wishes. https://t.co/7pUajtQM9P
1306590457426632704,2020-09-17 13:46:54,Very meaningful way of wishing. Thanks Sarbananda Ji. https://t.co/BrXbNqnjEq
1306590325771649026,2020-09-17 13:46:23,"Thanks for your wishes, @golayps Ji

I thank the people of Sikkim too. I can never forget my visits there. The hosp… https://t.co/jxoVXOyjeI"
1306589275291447297,2020-09-17 13:42:13,"Thank you very much, Mamata Didi. 

Shubho Mahalaya to you! https://t.co/Fp3dma36XQ"
1306588966095708161,2020-09-17 13:40:59,Grateful for the greetings @vijayanpinarayi. https://t.co/Ue0GAFgjsp
1306588767457701891,2020-09-17 13:40:12,Thanks a lot for your wishes! https://t.co/fTu23d1NZ4
1306587974033838081,2020-09-17 13:37:02,ಧನ್ಯವಾದಗಳು @BSYBJP ಅವರೇ. https://t.co/4quYd41rcv
1306587872590397440,2020-09-17 13:36:38,"Thank you very much, @ysjagan Garu. https://t.co/abDsVhHFE2"
1306587801622736897,2020-09-17 13:36:21,Thanks KCR Garu. I pray to the Almighty to grant health and happiness to you and the people of Telangana. https://t.co/UWJpZ0k36e
1306587701034975233,2020-09-17 13:35:57,Thanks Ashok Ji for your wishes. They mean a lot to me. https://t.co/zdKXJiuU45
1306587642046214152,2020-09-17 13:35:43,"Thanks for your warm wishes, @capt_amarinder Ji. https://t.co/b2pbXBFdfB"
1306587538430156804,2020-09-17 13:35:19,"Thank you very much, Arvind Ji. https://t.co/YyLhwkhZ2F"
1306587229569990664,2020-09-17 13:34:05,शुभेच्छाओं के लिए धन्यवाद @HemantSorenJMM  जी। https://t.co/BlWd9lg6bE
1306587011776569352,2020-09-17 13:33:13,धन्यवाद @PemaKhanduBJP जी। भगवान बुद्ध का आशीर्वाद सभी देशवासियों पर बना रहे। https://t.co/wmy5agFFK9
1306586900963057664,2020-09-17 13:32:47,हार्दिक आभार @ZoramthangaCM जी। https://t.co/6iQNYbtBqv
1306585876554633216,2020-09-17 13:28:42,बहुत-बहुत धन्यवाद @NitishKumar जी। https://t.co/UIaaHGngBi
1306585682891042817,2020-09-17 13:27:56,आभार @bhupeshbaghel जी। https://t.co/DbGLOGKKy2
1306585627782119427,2020-09-17 13:27:43,धन्यवाद @ChouhanShivraj जी। https://t.co/99Dj3QivFx
1306585556697055233,2020-09-17 13:27:26,आपका हार्दिक आभार @OfficeofUT जी। https://t.co/9cyKkneByJ
1306585492289286144,2020-09-17 13:27:11,धन्यवाद @vijayrupanibjp जी। https://t.co/Bu5A1PecJQ
1306585435481632769,2020-09-17 13:26:57,आपकी भावपूर्ण शुभकामनाओं के लिए बहुत-बहुत आभार @myogiadityanath जी। https://t.co/YmsmWeErkt
1306585355907334155,2020-09-17 13:26:38,हार्दिक आभार @tsrawatbjp जी। भगवान बदरीविशाल और बाबा केदार की कृपा समस्त देशवासियों पर बनी रहे। https://t.co/t1OtMs6EwV
1306585241499217920,2020-09-17 13:26:11,जन्मदिन पर शुभेच्छाओं के लिए बहुत-बहुत आभार @mlkhattar जी। https://t.co/y110nKDKCh
1306575631405051904,2020-09-17 12:48:00,जन्मदिन पर इस खूबसूरत बधाई संदेश के लिए बहुत-बहुत धन्यवाद डॉ. बिंदेश्वर पाठक जी। आपने जिस नए भारत का गौरवगान किया… https://t.co/72ClBnHU2r
1306573454741663744,2020-09-17 12:39:21,"Dinesh Bhai, thank you for the wishes. https://t.co/YpWiFTYtLG"
1306573388635189249,2020-09-17 12:39:05,Thanks @ManishTewari Ji. https://t.co/L9sRfEyBdf
1306572893719945217,2020-09-17 12:37:07,Thank you @bishnoikuldeep Ji. https://t.co/AvoDWkzYor
1306572819816357888,2020-09-17 12:36:49,Thanking my friend @BhupinderSHooda Ji for the wishes. https://t.co/v9jQZ5piWp
1306572748743819264,2020-09-17 12:36:32,Thank you @adhirrcinc Ji. https://t.co/3IhqvQA4QL
1306572152691290115,2020-09-17 12:34:10,Thank you @rajinikanth Ji. https://t.co/CcSjsqwrXo
1306571417744334851,2020-09-17 12:31:15,Lovely gesture @SachinSanghe. Grateful for the wishes. https://t.co/Xcl4MdRGyK
1306571329496203266,2020-09-17 12:30:54,Thank you- to you and the versatile Adithi for the wishes. https://t.co/4nJw5byUzR
1306570936057958401,2020-09-17 12:29:20,Mausami Ji thank you for the greetings. https://t.co/3M0GBLkZRU
1306570854944235521,2020-09-17 12:29:01,शुभकामनाओं के लिए धन्यवाद @sardanarohit जी। https://t.co/8gqAwIDn8f
1306570796236587008,2020-09-17 12:28:47,"I do recall the interview with @IndiaToday in Kashi. 

Thanks @anjanaomkashyap Ji for bringing those moments back t… https://t.co/kxuOHvnjAD"
1306570584801726472,2020-09-17 12:27:56,Thank you my young and energetic friend. https://t.co/c9NiNCIrdA
1306570486231441410,2020-09-17 12:27:33,"Thanks @PankajAdvani247. 

Best wishes for your future endeavours. https://t.co/oa7w0sfpVD"
1306570379746402304,2020-09-17 12:27:08,जन्मदिन पर मां के आशीर्वाद से बढ़कर और क्या हो सकता है। बहुत-बहुत धन्यवाद @AnupamPKher जी। https://t.co/PLGqK6JXCo
1306569987008598018,2020-09-17 12:25:34,Your greetings are very special @Vedmalik1 Ji. Thank you! Will continue doing everything possible for the welfare o… https://t.co/fz0rHVj2Oz
1306569781609259014,2020-09-17 12:24:45,"Anand Ji, thank you for the wishes. https://t.co/12IkCOdRb4"
1306569644916973568,2020-09-17 12:24:12,जन्मदिन पर इस शुभकामना संदेश के लिए आपका हृदय से आभार @SriSri जी। https://t.co/yfdgSjzj0d
1306569147015290880,2020-09-17 12:22:14,"I am very proud of my association with the @BAPS family, known for its impeccable service world-wide. I thank HH Ma… https://t.co/LaKn8yXO1t"
1306568891062132737,2020-09-17 12:21:13,"On this day, last year had the honour of being at the site of the dam and had paid tributes at the iconic ‘Statue o… https://t.co/OdrGQvaT7U"
1306554902181601281,2020-09-17 11:25:37,हृदय की गहराइयों से आपका आभार @TCGEHLOT जी। https://t.co/y6ML0N1ogB
1306554273816215554,2020-09-17 11:23:08,जन्मदिन पर शुभकामनाओं के लिए आपका हृदय से आभार @JPNadda जी। आपके नेतृत्व में करोड़ों भाजपा कार्यकर्ता जिस प्रकार स… https://t.co/iGpwgeIhWl
1306554110607458306,2020-09-17 11:22:29,"Pralhad Ji, thanks for your heartfelt wishes. It’s an honour to serve the people of India. https://t.co/AG4GgCtKso"
1306553978839130113,2020-09-17 11:21:57,"Thanks for your wishes, Dr. Jaishankar. With the kind of strength and skill that Indians bring to the table, nothin… https://t.co/i69Pcr6JEw"
1306553814258913280,2020-09-17 11:21:18,"Thanks for your wishes, Harsimrat Ji. In making an Aatmanirbhar Bharat, your work in the food processing sector is… https://t.co/jMTumcww0z"
1306553638563672067,2020-09-17 11:20:36,"Thanks for your thoughtful wishes, Nirmala Ji. Working for the empowerment of the poor and needy is a responsibilit… https://t.co/RcQrhLJAO9"
1306553502181679104,2020-09-17 11:20:04,"Thank you very much for your wishes, @DVSadanandGowda Ji. https://t.co/q8IGOD5YFf"
1306553269389389824,2020-09-17 11:19:08,इस भावपूर्ण शुभकामना संदेश के लिए आपका बहुत-बहुत आभार @gssjodhpur जी। https://t.co/4UVJMlsu1C
1306553153479794688,2020-09-17 11:18:41,धन्यवाद @girirajsinghbjp जी। https://t.co/m3LVLWD15d
1306553098232422406,2020-09-17 11:18:27,आभार @DrMNPandeyMP जी। https://t.co/fmXLH2E1tT
1306552966988443648,2020-09-17 11:17:56,बहुत-बहुत शुक्रिया @naqvimukhtar जी। https://t.co/BhRf8HRCpE
1306552901356015616,2020-09-17 11:17:40,इस बधाई संदेश के लिए आपका बहुत-बहुत आभार @dpradhanbjp जी। https://t.co/rETSmhl87m
1306552813967667200,2020-09-17 11:17:20,जन्मदिन पर शुभाकांक्षाओं के लिए आपका धन्यवाद @PiyushGoyal जी। https://t.co/EVpbSdr26v
1306552695126331392,2020-09-17 11:16:51,शुभेच्छाओं के लिए आपका बहुत आभार @PrakashJavdekar जी। https://t.co/StAKcoGDDY
1306552616499855365,2020-09-17 11:16:33,जन्मदिन की मंगलकामनाओं के लिए आपका बहुत-बहुत धन्यवाद @drharshvardhan जी। https://t.co/QpcAKn5joq
1306552508689522688,2020-09-17 11:16:07,शुभकामनाओं के लिए धन्यवाद @smritiirani जी। https://t.co/3L1opAfyZT
1306552405698334720,2020-09-17 11:15:42,बहुत-बहुत धन्यवाद @MundaArjun जी। https://t.co/bL2Dry2Vwj
1306552341642977280,2020-09-17 11:15:27,शुभकामना संदेश के लिए हार्दिक धन्यवाद @DrRPNishank जी। https://t.co/l8I1sSoEeL
1306551947747495943,2020-09-17 11:13:53,धन्यवाद @rsprasad जी। https://t.co/9doS3izWBa
1306551892705554432,2020-09-17 11:13:40,शुभकामनाओं के लिए बहुत-बहुत आभार @nstomar जी। https://t.co/4b71Q49Y5G
1306551825437323270,2020-09-17 11:13:24,आपका बहुत-बहुत धन्यवाद @irvpaswan जी। https://t.co/Dc9KC2LEM4
1306527193812537344,2020-09-17 09:35:31,Always humbled to receive your wishes @H_D_Devegowda Ji. Your contribution towards national development is immense. https://t.co/jXf4Fi198W
1306527065500348416,2020-09-17 09:35:01,"I thank all my distinguished colleagues and friends for their wishes.

Also a word of appreciation for the… https://t.co/D9zEcq2xF2"
1306526918028582913,2020-09-17 09:34:26,Extremely kind of you Partha Ji. https://t.co/4y7bEhnqeh
1306526767478235136,2020-09-17 09:33:50,Thank you Naveen Ji for the wishes! https://t.co/R3Aya8SAqv
1306526502536622080,2020-09-17 09:32:46,Humbled by the gesture. Thank you. https://t.co/Mj5bd3et4g
1306526427861250049,2020-09-17 09:32:29,Thanking the entire family for the greetings. https://t.co/vnorLx4ZsY
1306526327525183488,2020-09-17 09:32:05,I thank the respected @SriMspeaks for his greetings. I always cherish my interactions with him. https://t.co/XIMtywHpX7
1306526141629440000,2020-09-17 09:31:20,Appreciate the good wishes. https://t.co/CdYezUDKE1
1306525909134880768,2020-09-17 09:30:25,Thank you @nikhat_zareen. https://t.co/YA3rAadz7j
1306525628049498112,2020-09-17 09:29:18,The transformational changes in India have occurred due to the support and participation of my fellow Indians. Hono… https://t.co/4Tisu6nT4C
1306525511233937409,2020-09-17 09:28:50,Glad to receive your wishes @Mohanlal Ji. https://t.co/MDTLLMJKzY
1306525343205842946,2020-09-17 09:28:10,"Thankful for your wishes, my friend @KChiruTweets Garu. Hope you are doing well. https://t.co/EC11MczMB8"
1306524293094805504,2020-09-17 09:24:00,शुभकामनाओं के लिए आभार @sachin_rt  जी। https://t.co/Fi9Kwr6K17
1306524158222716934,2020-09-17 09:23:28,Humbled by your wishes. Great gesture of planting Tulsi and Marigold. https://t.co/rlcL0gTW2X
1306523480796454913,2020-09-17 09:20:46,Thanks Sanjay Ji. https://t.co/oQZBnlNG6B
1306523151455498245,2020-09-17 09:19:27,Thank you @AnilKapoor Ji. Your fitness regime can inspire many youngsters out there! https://t.co/zH12DOA02s
1306522866943361024,2020-09-17 09:18:20,Thanks for the wishes @RahulGandhi Ji. https://t.co/7U4RMsj0xd
1306522706427305989,2020-09-17 09:17:41,Thank you @ikamalhaasan for your greetings. https://t.co/9fTuWRYwyJ
1306522548939624448,2020-09-17 09:17:04,धन्यवाद @vikasbha जी। https://t.co/MSBmiS8H2n
1306522456295792640,2020-09-17 09:16:42,बहुत-बहुत धन्यवाद @Mayawati जी। https://t.co/PY2ESVAXsV
1306522299579867136,2020-09-17 09:16:04,Thanks Sudhir Ji. https://t.co/xg33sez4dD
1306499412365987842,2020-09-17 07:45:08,"I am delighted you have brought back memories from my student days and especially memories of my teacher, late Prav… https://t.co/PYYyCpKUS5"
1306494117967400961,2020-09-17 07:24:05,जन्मदिन पर इस क्रिएटिव संदेश के लिए आपका हृदय से धन्यवाद @amit_jurno जी। https://t.co/7NFexFNGZm
1306493525828104192,2020-09-17 07:21:44,"Thank you. I consider myself fortunate to be able to serve Bhagwan Shri Krishna. 

Hare Krishna to the large and vi… https://t.co/xQnOWwDBqp"
1306492757263826944,2020-09-17 07:18:41,Thank you for the greetings. It’s an honour to serve my fellow Indians. https://t.co/5aiGxtOOQM
1306492640603430912,2020-09-17 07:18:13,जन्मदिन की शुभकामनाओं के लिए बहुत-बहुत धन्यवाद @chitraaum जी। https://t.co/px4myfhq7N
1306491969103781889,2020-09-17 07:15:33,Thank you Aman. https://t.co/1eht6qBAbP
1306491908047294465,2020-09-17 07:15:18,Creative! Thanks for the wishes. https://t.co/HDnPX8StWV
1306491742636580865,2020-09-17 07:14:39,"Thank you Ravindra.

Have known you for years and have been seeing you work hard. https://t.co/96rGzHmUig"
1306491613930074112,2020-09-17 07:14:08,Innovative! Grateful for the wishes. https://t.co/CuxhlpYlT2
1306491519344369665,2020-09-17 07:13:46,Thank you! https://t.co/sbUkl4gQ3F
1306491237269082112,2020-09-17 07:12:39,Thank you Uday Bhai. You have highlighted initiatives that are indeed very close to my heart. We have been able to… https://t.co/IRwzoS1soK
1306491135129341957,2020-09-17 07:12:14,Thank you! https://t.co/x75WfJUAJO
1306490981890490368,2020-09-17 07:11:38,It has been an eventful and memorable journey. I am happy that my work has been able to create a positive differenc… https://t.co/uKVNDRXsgC
1306490220368388097,2020-09-17 07:08:36,Adorable! I thank these young friends for wishing me. https://t.co/Ku1xAkqhwW
1306489931687235584,2020-09-17 07:07:27,बधाई के लिए धन्यवाद @DChaurasia2312 जी। https://t.co/pBeJYQXnJk
1306489746047135744,2020-09-17 07:06:43,मणिनगर के अपने भाइयों और बहनों की सेवा करना मेरे लिए गर्व का विषय रहा है। इस क्षेत्र में हम जन कल्याण के बेहतरीन का… https://t.co/kl9wl9yV5j
1306489630536032258,2020-09-17 07:06:15,"Narendra says hello to young Narendra!

Gratitude to your son and you for the wishes. https://t.co/PKMsCzruDo"
1306489448553541633,2020-09-17 07:05:32,बहुत-बहुत धन्यवाद @RajatSharmaLive जी। https://t.co/QJrUzXNk6H
1306489354055897088,2020-09-17 07:05:10,Thank you @Amul_Coop! Your wishes are as sweet as your ice creams and chocolates. Best wishes to you as you make In… https://t.co/sMwXbpbO0F
1306488863649480705,2020-09-17 07:03:13,"आपने जिस अंदाज में शुभकामनाएं दीं, वह दिल को छू लेने वाला है। बहुत-बहुत धन्यवाद @k_satyarthi जी। https://t.co/6p8T5OUtgz"
1306488688445071360,2020-09-17 07:02:31,"I thank @BobBlackman for the greetings. 

Bob is a friend of our nation, and is a hardworking MP, always serving hi… https://t.co/pkZ5XKPKIa"
1306485334272688130,2020-09-17 06:49:11,"Thank you, Excellency @kpsharmaoli ji! We look forward to the further strengthening of India-Nepal ties, based on o… https://t.co/UCxs70ftOh"
1306485248805404672,2020-09-17 06:48:51,"Thank you, Lyonchhen @pmbhutan for your warm good wishes and prayers! 

We cherish the India-Bhutan friendship as a… https://t.co/wpRdZVT4HS"
1306484063109181440,2020-09-17 06:44:08,आपकी शुभेच्छा के लिए हृदय से आभार @mangeshkarlata दीदी। आपका स्नेह और आशीर्वाद मुझे हमेशा मां भारती की सेवा के लिए… https://t.co/QufarUtEiU
1306483477789827072,2020-09-17 06:41:49,जन्मदिन पर शुभकामनाओं के लिए हृदय से आभार आदरणीय @drmmjoshibjp जी। https://t.co/8GhRsugjCm
1306483374735810561,2020-09-17 06:41:24,शुभकामनाओं के लिए धन्यवाद @nitin_gadkari जी। https://t.co/0dk6iwtZFH
1306483120481345536,2020-09-17 06:40:23,बधाई संदेश के लिए बहुत-बहुत धन्यवाद @AmitShah जी। https://t.co/gogVwAlh42
1306482733128978433,2020-09-17 06:38:51,Thank you @rajnathsingh Ji for your wishes. It is always a delight to work with you. https://t.co/JGAyITUxAO
1306482172379893760,2020-09-17 06:36:37,शुभकामनाओं के लिए आपका बहुत-बहुत धन्यवाद @ombirlakota जी। https://t.co/llYkVsZv8p
1306482049667088384,2020-09-17 06:36:08,"Thank you for your warm wishes, Honourable Vice President @MVenkaiahNaidu Garu. https://t.co/em2ohZMI7z"
1306481871564333057,2020-09-17 06:35:26,इन शुभकामनाओं के लिए बहुत-बहुत धन्यवाद माननीय @rashtrapatibhvn जी। https://t.co/Qnkl0R0hoz
1306457635596632064,2020-09-17 04:59:07,"This Mahalaya, we pray to Maa Durga to bless with strength to overcome the global pandemic. May the divine blessing… https://t.co/UD4sCp3fwg"
1306457203998511105,2020-09-17 04:57:24,"विश्वकर्मा जयंती की सभी देशवासियों को बहुत-बहुत शुभकामनाएं। आज का दिन उन लोगों को समर्पित है, जिनके लिए कर्म ही पू… https://t.co/lA0tYNgd3v"
1306280603738951681,2020-09-16 17:15:40,"Shri P. R. Krishna Kumar’s persistent, enterprising and mission-mode efforts contributed to Ayurveda’s global popul… https://t.co/zONOuKiN95"
1306272925616545793,2020-09-16 16:45:09,ગુજરાત સરકારના પૂર્વ મંત્રી અને પાટણના પૂર્વ સાંસદ શ્રી લીલાધરભાઈ વાઘેલાના અવસાનથી દુ:ખની લાગણી અનુભવું છું. ભગવાન… https://t.co/WvRbGwBDfs
1306232363106492416,2020-09-16 14:03:58,"Saddened by the demise of Lok Sabha MP, Balli Durga Prasad Rao Garu. He was an experienced leader, who made effecti… https://t.co/2wDq2USKg2"
1306103807332540417,2020-09-16 05:33:08,Heartiest congratulations to Excellency Yoshihide Suga on the appointment as Prime Minister of Japan @kantei. I loo… https://t.co/bCCMBvuymb
1306103397926535170,2020-09-16 05:31:30,日本国首相へのご就任を心よりお祝い申し上げます。閣下とともに印日特別戦略的グローバルパートナーシップをさらなる高みに到達させることを期待しています。@sugawitter
1305867680138891264,2020-09-15 13:54:51,"दरभंगा में एम्स के निर्माण से जहां बिहार के हेल्थ इंफ्रास्ट्रक्चर को मजबूती मिलेगी, वहीं स्वस्थ भारत के संकल्प को… https://t.co/ykxSSFjatU"
1305867555274477571,2020-09-15 13:54:21,हरियाणा के लोगों के लिए बड़ी खुशखबरी है। मंत्रिमंडल ने पलवल से सोनीपत तक हरियाणा ऑर्बिटल रेल कॉरिडोर परियोजना को मं… https://t.co/NVbbfdXCkB
1305825928421888000,2020-09-15 11:08:57,"हमें याद रखना है- जब तक दवाई नहीं, तब तक ढिलाई नहीं। https://t.co/l3dc6fjomi"
1305825838160465921,2020-09-15 11:08:35,"Greetings to all Engineers on Engineers Day. We remember Sir M. Visvesvaraya on his Jayanti. 

India is proud of th… https://t.co/WaXxUT2OuC"
1305825565023154182,2020-09-15 11:07:30,नमामि गंगे मिशन के तहत बिहार सहित पूरे देश में 180 से अधिक घाटों के निर्माण का काम चल रहा है। इनमें से 130 घाट पूरे… https://t.co/OKelp26MuF
