id,created_at,text
1362750766876741633,2021-02-19 13:07:56,महान गांधीवादी धरमपाल जी की एक पुस्तक में 1820 में थॉमस मुनरो द्वारा किए गए एक राष्ट्रीय शिक्षा सर्वे का ब्योरा है।… https://t.co/rkUCAXJWd4
1362750701676371970,2021-02-19 13:07:40,"अगर फैसले लेने का हौसला चला गया, तो मान लीजिए कि आपकी जवानी चली गई, आप युवा नहीं रहे।  

जब तक भारत के युवा में नया… https://t.co/aPPr02i3DI"
1362750652951130116,2021-02-19 13:07:29,"गुरुदेव की विश्व भारती से अपेक्षा थी कि यहां जो सीखने आएगा, वह पूरी दुनिया को भारत और भारतीयता की दृष्टि से देखेगा।… https://t.co/deAzMVYmOO"
1362727382583373832,2021-02-19 11:35:00,Inaugurating development projects in Kerala. #BetterInfra4BrightKerala https://t.co/UEHLpQdsKV
1362640646998089732,2021-02-19 05:50:21,Addressing the Visva-Bharati. Watch. https://t.co/HDxyZLMVc7
1362623373256183810,2021-02-19 04:41:43,Speaking at the India-Australia Circular Economy Hackathon Award Ceremony. https://t.co/nM1wYCQNQg
1362605793543999496,2021-02-19 03:31:51,"मां भारती के अमर सपूत छत्रपति शिवाजी महाराज को उनकी जयंती पर शत-शत नमन। उनके अदम्य साहस, अद्भुत शौर्य और असाधारण बु… https://t.co/aGrU7tnbL2"
1362411877897277454,2021-02-18 14:41:18,"Tomorrow, 19th February at 4:30 PM, a number of development works for Kerala would be inaugurated. These works cove… https://t.co/IIwog0oSGX"
1362411811836936198,2021-02-18 14:41:02,Visva-Bharati is a prized centre of learning. It is closely associated with the ideals of the great Gurudev Tagore.… https://t.co/WL99tyTFEe
1362396234951004161,2021-02-18 13:39:09,"अगर सामान्य जन की सुविधा प्राथमिकता हो और विकास का लक्ष्य अटल हो, तो नए रास्ते बन ही जाते हैं। माजुली और निमाटी के… https://t.co/RSP0VtWxdX"
1362396116466081792,2021-02-18 13:38:40,"बीते वर्षों में असम की मल्टी मॉडल कनेक्टिविटी को फिर से स्थापित करने के लिए एक के बाद एक कदम उठाए गए हैं। 

कोशिश य… https://t.co/BoWKVWQfc7"
1362396051429199878,2021-02-18 13:38:25,असम में आज ‘महाबाहु ब्रह्मपुत्र’ प्रोग्राम शुरू किया गया है। इसके जरिए ब्रह्मपुत्र के जल से इस पूरे क्षेत्र में Wat… https://t.co/hKlk8Bt3y0
1362396008110465028,2021-02-18 13:38:15,असम और नॉर्थ ईस्ट के अलग-अलग हिस्सों को जोड़ने के अभियान को आज और आगे बढ़ाया गया है। https://t.co/oEjOPtmYwj
1362394337418514436,2021-02-18 13:31:36,"RT @mansukhmandviya: ‘महान बाहु तु ही है, जीबोनधारा एक तु,
लहर लहर में मार्ग है, गती की धारा एक तु, 
ओ ब्रह्मपुत्र महाबाहु रक्तवर्णी जीबोन…"
1362357209988960257,2021-02-18 11:04:04,Spoke with my good friend PM @ScottMorrisonMP today. Reiterated our commitment to consolidating our Comprehensive S… https://t.co/f7k9blYjpO
1362334597179052041,2021-02-18 09:34:13,Working towards a healthy and COVID-19 free neighbourhood. https://t.co/tsP5e8eMp9
1362308017421651968,2021-02-18 07:48:36,Working towards #AatmanirbharAssam. Watch. https://t.co/XEBMvejwaX
1362269867445915649,2021-02-18 05:17:00,"On popular demand, ‘Pariksha Pe Charcha 2021’ will also include parents and teachers. It’ll be a fun filled discuss… https://t.co/IhOOr7jvbY"
1362269738731073537,2021-02-18 05:16:30,"As our brave #ExamWarriors start padding up for their exams, ‘Pariksha Pe Charcha 2021’ returns, this time fully on… https://t.co/RShLiuKVCJ"
1362070480140787712,2021-02-17 16:04:43,"Spoke to HM Sultan Haitham bin Tarik of Oman. We discussed our Strategic Partnership, and our close cooperation dur… https://t.co/SGXe1FdUdP"
1362061048430292998,2021-02-17 15:27:14,"Tomorrow, 18th February is a landmark day for Assam’s development journey. The Mahabahu-Brahmaputra initiative will… https://t.co/cKDV7C6m2e"
1362060967937409026,2021-02-17 15:26:55,"Deepening connectivity, improving prosperity. 

Today’s Cabinet decision pertaining to a PLI Scheme for the telecom… https://t.co/eIlZ777cFp"
1362020506271182852,2021-02-17 12:46:08,A request to all those youngsters in the start-up world. #NTLF2021 https://t.co/zKn3ZpthmC
1362020433747394567,2021-02-17 12:45:51,Leveraging the power of technology for good governance. #NTLF2021 https://t.co/4dKsV7Mswj
1362020331058327553,2021-02-17 12:45:26,Imprint of India's IT industry is global. #NTLF2021 https://t.co/TbLBU112ry
1362020237466550280,2021-02-17 12:45:04,"When the chips were down, your code kept things running! #NTLF2021 https://t.co/tgRRbNkQUW"
1361997490677903360,2021-02-17 11:14:41,Inaugurating important projects relating to Aatmanirbharta in the energy sector. https://t.co/wEW11egO7j
1361936556974477314,2021-02-17 07:12:33,Speaking at #NTLF2021. Watch. https://t.co/PEii3F8mOP
1361866114590941186,2021-02-17 02:32:38,Greetings to Telangana CM KCR Garu on his birthday. Praying for his long and healthy life.
1361710755737837572,2021-02-16 16:15:18,"Yet another step towards becoming Aatmanirbhar in the energy sector! 

At 4:30 PM tomorrow, will dedicate to the na… https://t.co/d95K8gmA8X"
1361710503966298112,2021-02-16 16:14:18,"At 12:30 PM tomorrow, 17th February, will be speaking at the @nasscom Technology and Leadership Forum. This is a vi… https://t.co/KZFzVPjb2g"
1361698207781240839,2021-02-16 15:25:26,रोगों से मुक्त और मानसिक रूप से सशक्त नागरिक भारत को नई ऊंचाइयों पर ले जाएंगे। https://t.co/nqclOCeC7N
1361698097118773250,2021-02-16 15:25:00,"India is honoured to do whatever required to create a healthy planet, with a focus on overall wellness in addition… https://t.co/iXQVQJ1GSC"
1361698005322264582,2021-02-16 15:24:38,"India’s human centric approach is based on a healthy balance among:

Welfare. 

Well-being. 

Wealth. https://t.co/LjnHQ7dSZE"
1361679865561436163,2021-02-16 14:12:33,Pleased to meet with COP26 President-designate @AlokSharma_RDG today. We discussed India-UK cooperation on climate… https://t.co/vSdpPeF7Sk
1361670863754567680,2021-02-16 13:36:47,छोटे और सीमांत किसानों के जीवन में समृद्धि और खुशहाली लाने के लक्ष्य के साथ आज सरकार कृषि क्षेत्र में अनेक महत्वपू… https://t.co/xBL1C3bbxG
1361670778354364420,2021-02-16 13:36:26,"उत्तर प्रदेश में जिस प्रकार आज आधुनिक इंफ्रास्ट्रक्चर पर काम चल रहा है, उससे राज्य में उद्योग लगाने के लिए देश और… https://t.co/iN9h5ij6h0"
1361670712122101763,2021-02-16 13:36:11,"इतिहास की किताबों में भले ही महाराजा सुहेलदेव के शौर्य और पराक्रम को सही स्थान नहीं मिला, लेकिन पूर्वांचल की लोकगा… https://t.co/af7iUCtYQ4"
1361641852596744197,2021-02-16 11:41:30,Celebrating 75 years of Shri Ram Chandra Mission. https://t.co/fYQ2ViZRoR
1361585116548452355,2021-02-16 07:56:03,"This evening, will address a programme to mark 75 years of the Shri Ram Chandra Mission. The Mission is at the fore… https://t.co/0M7rebYvcm"
1361566156054757379,2021-02-16 06:40:42,Justice (Retd.) M. Rama Jois was a towering intellectual and jurist. He was admired for his rich intellect and cont… https://t.co/iKnLGAwM1d
1361553716927557632,2021-02-16 05:51:17,A tribute to the great Maharaja Suheldev. https://t.co/emgua921lP
1361514570649456640,2021-02-16 03:15:44,"Good initiative to showcase India’s talent, traditions and toys. https://t.co/2V9dC83HkL"
1361514374083485696,2021-02-16 03:14:57,बसंत पंचमी और सरस्वती पूजा के पावन अवसर पर आप सभी को हार्दिक शुभकामनाएं।
1361292436480266248,2021-02-15 12:33:03,Handed over a Chadar that would be offered at the Ajmer Sharif Dargah on the 809th Urs of Khwaja Moinuddin Chisti. https://t.co/DHa1f5p0kk
1361220025357508612,2021-02-15 07:45:18,These reforms demonstrate our commitment to improving ease of doing business in India by deregulation.… https://t.co/qc9dQw3osx
1361219820105003010,2021-02-15 07:44:30,India’s farmers will also be benefited by leveraging the potential of geo-spatial &amp; remote sensing data.  Democrati… https://t.co/E7YK3awyR4
1361219523429326851,2021-02-15 07:43:19,"The reforms will unlock tremendous opportunities for our country’s start-ups, private sector, public sector and res… https://t.co/dKYCZ2XUuW"
1361219135473025024,2021-02-15 07:41:46,Our government has taken a decision that will provide a huge impetus to Digital India. Liberalising policies govern… https://t.co/SddaHM77Nn
1361146907549179904,2021-02-15 02:54:46,"Through inspiring examples, January’s #MannKiBaat highlighted diverse topics ranging from art, culture, tourism and… https://t.co/FWBiCYsME0"
1361146670948487168,2021-02-15 02:53:49,"My visit to Tamil Nadu was memorable.

Have a look at some of the highlights from yesterday. https://t.co/foTTAu7BRl"
1361146507966185482,2021-02-15 02:53:11,Happy to have inaugurated development works that will have a positive impact in the lives of Kerala's wonderful cit… https://t.co/c5Pb1l5Wkj
1360999601285730304,2021-02-14 17:09:25,"After decades, a long-standing demand of the Devendrakula Velalar community has been fulfilled. https://t.co/NGGeadIcj2"
1360997820929503232,2021-02-14 17:02:21,The Government of India will always protect the rightful interests of India’s fishermen. https://t.co/SqES9JD6md
1360997233588539393,2021-02-14 17:00:01,Creating a prosperous Blue Economy in order to realise the dream of Aatmanirbhar Bharat. https://t.co/vFMPtNX0xh
1360997112704503808,2021-02-14 16:59:32,NDA Government will always work for the well-being of those Indians working in the Gulf. https://t.co/jPEfVFSpUg
1360936595751272453,2021-02-14 12:59:04,It was an honour to interact with respected Bangaru Adigalar Ji in Chennai earlier today. His efforts to serve soci… https://t.co/mzopb1bvhF
1360919592772714504,2021-02-14 11:51:30,An interesting project that will further effective usage of water resources in Tamil Nadu. It will especially benef… https://t.co/fUH75dWacm
1360919515249471488,2021-02-14 11:51:11,Discovery Campus of IIT-Madras will enable the culture of research and innovation to flourish. https://t.co/rvnIaYQXOQ
1360919421976469506,2021-02-14 11:50:49,The Chennai Metro furthers comfort and convenience for people of this dynamic city. https://t.co/hE5Kh3pgEz
1360919336878284804,2021-02-14 11:50:29,Quicker movement of freight is good news for the world of commerce. https://t.co/kuFBOC14EB
1360919211753766912,2021-02-14 11:49:59,"Tamil Nadu is emerging as a tank production hub. From Tamil Nadu, the movement towards a modernised and self-relian… https://t.co/smyzpU5efr"
1360908569139236868,2021-02-14 11:07:41,"My speech at a programme in Kochi, Kerala. https://t.co/6uPmgDtThd"
1360872166175113217,2021-02-14 08:43:02,Caught a fleeting view of an interesting test match in Chennai. 🏏 🇮🇳 🏴󠁧󠁢󠁥󠁮󠁧󠁿 https://t.co/3fqWCgywhk
1360865603901390853,2021-02-14 08:16:58,"A special day in our journey to become Aatmanirbhar in the defence sector. 

Arjun Main Battle Tank (MK-1A) was han… https://t.co/gOxF0UFR8x"
1360858210966663168,2021-02-14 07:47:35,"Thank you Chennai! 

Overwhelmed by the affectionate welcome. https://t.co/IKMzIUxNw9"
1360845731322425344,2021-02-14 06:58:00,Development works that will help all sections of society. Watch from Chennai. https://t.co/b9QNo77Buw
1360779559415795719,2021-02-14 02:35:03,Leaving for Chennai and Kochi. https://t.co/bSImPnGphD
1360595210187673600,2021-02-13 14:22:31,കേരളത്തിലെ ജനങ്ങൾക്കിടയിലേയ്ക്ക്  എത്തുന്നത്  ഞാൻ ഉറ്റു നോക്കുകയാണ്.
1360595181620191241,2021-02-13 14:22:24,പ്രാദേശിക അടിസ്ഥാന സൗകര്യങ്ങൾ മെച്ചപ്പെടുത്തുന്നതിനും വാണിജ്യം അഭിവൃദ്ധിപ്പെടുത്തുന്നതിനും സംസ്ഥാനത്തെ യുവാക്കൾക്ക്… https://t.co/CKlBrl5Bsh
1360594692245626882,2021-02-13 14:20:27,பல்வேறு திட்டங்களைத் தொடங்கி வைக்கும் ஒரு நிகழ்ச்சியில் கலந்துகொள்வதற்காக நாளை நான்  சென்னையில் இருப்பேன்.  நீர்ப்… https://t.co/WEonc7o7lT
1360594492001198088,2021-02-13 14:19:40,"Tomorrow, 14th February, will be in Chennai (Tamil Nadu) and Kochi (Kerala). Numerous development works would be la… https://t.co/PQN1x4ODiF"
1360593897542483969,2021-02-13 14:17:18,This speech by FM @nsitharaman Ji gives a comprehensive view on aspects relating to the Budget. She talks about how… https://t.co/Om866FCawj
1360593365742460934,2021-02-13 14:15:11,"A wonderful speech by Home Minister Shri @AmitShah in the Lok Sabha. Extensive in detail and rich in content, it hi… https://t.co/eHylfBHclM"
1360425373763162112,2021-02-13 03:07:39,Happy World Radio Day! Greetings to all radio listeners and kudos to all those who keep the radio buzzing with inno… https://t.co/eels6E3iBj
1360220777996517378,2021-02-12 13:34:39,Met newly elected @BJP4India Rajya Sabha MPs. Wished them the very best for their Parliamentary innings. https://t.co/LQIvRi9vaQ
1359824451303481345,2021-02-11 11:19:48,"दीनदयाल जी के पास क्या था, कुछ नहीं था।

वे अनिकेत थे, अकिंचन थे, न घर था, न धन था, लेकिन हमारे दिलों में आज भी हैं… https://t.co/xkcMTIrxzn"
1359824354184368131,2021-02-11 11:19:25,"मैं अपने सभी सांसदों से यह आग्रह करूंगा... 

 #SamarpanDiwas https://t.co/jUdVYRSS4s"
1359824257404968961,2021-02-11 11:19:01,"हमारी विचारधारा देशभक्ति से शुरू होती है, देशभक्ति से प्रेरित होती है और देशहित में होती है। हम उसी विचारधारा में प… https://t.co/XRbgJCRI0b"
1359824172805857287,2021-02-11 11:18:41,"कोरोना काल में देश ने अंत्योदय की भावना को सामने रखा और अंतिम पायदान पर खड़े हर गरीब की चिंता की।

आत्मनिर्भरता की… https://t.co/u1zsUvONZb"
1359824084507316224,2021-02-11 11:18:20,"हमारे यहां कहा जाता है- स्वदेशे पूज्यते राजा विद्वान सर्वत्र पूज्यते।

दीनदयाल जी इस विचार के साक्षात उदाहरण हैं।… https://t.co/1XEutQcBMu"
1359742085889286148,2021-02-11 05:52:30,Addressing BJP MPs. Watch.  #SamarpanDiwas https://t.co/dh7h62nAJC
1359546935586287619,2021-02-10 16:57:03,Was happy to receive a call from my friend @JustinTrudeau.  Assured him that India would do its best to facilitate… https://t.co/5TSXmJhLHx
1359531529106554881,2021-02-10 15:55:50,"The life and mission of Deendayal Ji inspires us all. 

On his Punya Tithi tomorrow, 11th February, will be address… https://t.co/r603Zh5PfZ"
1359523467704598528,2021-02-10 15:23:48,"Tashakkur, brother @Arbab911!

This is a wonderful gesture, for which I am honoured. 

Afghan-Hind dosti Zindabaad! https://t.co/N3zq9qu1Jo"
1359523133196275716,2021-02-10 15:22:28,India is proud of the role of the private sector in national progress and in enhancing India’s prestige globally. https://t.co/CydKIVOSjd
1359523041760395269,2021-02-10 15:22:06,"The view that, ‘no one asked for reforms’ is deeply problematic. A progressive society will always embrace reforms… https://t.co/w7piUVekSX"
1359520659660021765,2021-02-10 15:12:38,"किसान के पवित्र आंदोलन को बदनाम करने का काम आंदोलनकारियों ने नहीं, आंदोलनजीवियों ने किया है। इसलिए देश को आंदोलनका… https://t.co/JPL7LJMSZl"
1359520557910405121,2021-02-10 15:12:14,"ना खेलब ना खेले देब, खेलवे बिगाड़ब… https://t.co/gZAuOPMtkg"
1359520477379706887,2021-02-10 15:11:55,"जब तक हम निवेश नहीं लाएंगे, 
जब तक खेती को आधुनिक नहीं करेंगे, 
जब तक छोटे से छोटे किसानों की भलाई के लिए व्यवस्था… https://t.co/k6ggKGTwid"
1359520202115997700,2021-02-10 15:10:49,"देश को तबाह करने में Status quo की मानसिकता का बड़ा रोल है। कब तक ऐसा करते रहेंगे, देश की युवा पीढ़ी ज्यादा इंतजार… https://t.co/snizoUzO6M"
1359520067579445258,2021-02-10 15:10:17,"नए कानून बनने के बाद क्या किसी भी किसान के पुराने हक को छीन लिया गया है? सब कुछ वैसा ही है। 

एक अतिरिक्त विकल्प की… https://t.co/GeBz5JjlEK"
1359519868899495936,2021-02-10 15:09:30,"जिस संस्कार को लेकर वेद से लेकर विवेकानंद तक हम पले-बढ़े हैं, वे हैं- सर्वे भवंतु सुखिनः, सर्वे संतु निरामया। कोरो… https://t.co/ai5slL8x4D"
1359496792686043136,2021-02-10 13:37:48,Addressing the World Sustainable Development Summit. https://t.co/PZsoUMzfRe
1359453591828717570,2021-02-10 10:46:08,Speaking in the Lok Sabha. https://t.co/23xHQXbIxH
1359323072591876104,2021-02-10 02:07:30,"At 6:30 PM this evening, will inaugurate the World Sustainable Development Summit 2021. This Summit brings together… https://t.co/9KyXvWG7rK"
1359051020911845379,2021-02-09 08:06:27,Signing MoU on Shahtoot Dam with President @ashrafghani. https://t.co/Ltfbn8jk0J
1359005993485570048,2021-02-09 05:07:32,Watch my remarks in the Rajya Sabha. https://t.co/Cte2AR0UVs
1358831328263741441,2021-02-08 17:33:29,President @JoeBiden and I are committed to a rules-based international order. We look forward to consolidating our… https://t.co/eYuZmJdPSv
1358831326602817537,2021-02-08 17:33:28,Spoke to @POTUS @JoeBiden and conveyed my best wishes for his success.  We discussed regional issues and our shared… https://t.co/57qZ30MwvW
1358808797062434818,2021-02-08 16:03:57,"The emerging message from West Bengal is- they have faith in politics of development, not politics of corruption an… https://t.co/xqdgVZQnuv"
1358808501825376258,2021-02-08 16:02:46,Thank you Assam! https://t.co/PyuNd2WS3I
1358739316617351168,2021-02-08 11:27:51,Committed to the welfare of the hardworking farmer and the transformation of the agriculture sector. https://t.co/DVrrLnsYsP
1358738443128299524,2021-02-08 11:24:23,बहुत कम जमीन वाले किसानों की संख्या 12 करोड़ से ज्यादा है। क्या इन किसानों के प्रति देश की कोई जिम्मेदारी नहीं है?… https://t.co/1s9yf7PRvF
1358737966743494656,2021-02-08 11:22:30,"अवसर तेरे लिए खड़ा है, 
तू आत्मविश्वास से भरा पड़ा है। 
हर बाधा, हर बंदिश को तोड़,
अरे भारत! 
आत्मनिर्भरता के पथ पर… https://t.co/4EUydOSgVT"
1358737347731279874,2021-02-08 11:20:02,"MSP है, MSP था, MSP रहेगा... https://t.co/lh6Xv1oth1"
1358737254898827265,2021-02-08 11:19:40,India...the Mother of Democracy. https://t.co/mvAnYLAip6
1358737202256117763,2021-02-08 11:19:27,"COVID-19 - a new challenge that brought out the best in us.

India is strengthening the global fight against the pa… https://t.co/jMlcJN9t75"
1358642201664712705,2021-02-08 05:01:57,Speaking in the Rajya Sabha. https://t.co/lepprXZ8Ak
1358459528484823040,2021-02-07 16:56:05,पश्चिम बंगाल को फिर से देश के अहम Trading और Industrial Centre के रूप में विकसित करने के लिए हम निरंतर काम कर रहे… https://t.co/plUHL8BcoL
1358459430648483840,2021-02-07 16:55:41,"प्रधानमंत्री ऊर्जा गंगा पाइपलाइन का एक और बड़ा हिस्सा आज जनता की सेवा में समर्पित हो चुका है।

लगभग 350 किलोमीटर की… https://t.co/GAagoY7n8N"
1358459270996496385,2021-02-07 16:55:03,"The number of fouls committed by TMC are many. 

No wonder the people will punish them. https://t.co/a6LcYM5F83"
1358459146715111424,2021-02-07 16:54:34,My promise to the people of West Bengal. https://t.co/lRQTxSYxs7
1358458892410187778,2021-02-07 16:53:33,"In West Bengal TMC, Left and Congress have:

Criminalised politics. 

Institutionalised corruption. 

Politicised t… https://t.co/ZV1PpGJ44J"
1358458765205360641,2021-02-07 16:53:03,West Bengal’s talented people have not got the development they deserve. This is because of the political leadershi… https://t.co/RvYFBW6xQx
1358457913157644290,2021-02-07 16:49:40,"தேநீர் இந்தியாவின் பெருமை! 

ஆனால், சிலருக்கு தேநீர் பிரச்சனையாக இருப்பதையும், அதனால் அதற்கு எதிராக அவர்கள் பெரும்… https://t.co/mW9J3hoM8z"
1358457812121124864,2021-02-07 16:49:15,"തേയില ഇൻഡ്യയുടെ അഭിമാനമാണ് .
പക്ഷേ , തേയിലയോട് പ്രശ്നമുള്ള ചിലർ അതിനെതിരെ വൻ പ്രചാരണങ്ങൾ നടത്തുന്നത് കാണുമ്പോൾ ക… https://t.co/dLfWuluBJs"
1358457585544749060,2021-02-07 16:48:21,"Tea is India’s pride. It is closely linked with Assam. 

But, sad to see some people running grand campaigns agains… https://t.co/CgB0VOptPQ"
1358457055204438016,2021-02-07 16:46:15,A glimpse of the progress in Assam during the last five years. https://t.co/hOx3zLRzQg
1358456863625342976,2021-02-07 16:45:29,"Sonitpur has a glorious past, rich culture and is home to dynamic citizens. 

From Sonitpur begins an important con… https://t.co/SzfdlIVh4j"
1358385637624221698,2021-02-07 12:02:28,Inaugurating development works at Haldia. https://t.co/awjGwSdcc6
1358368988162498562,2021-02-07 10:56:18,Speaking in Haldia. Watch. https://t.co/jLYjLBbFJQ
1358330186337570817,2021-02-07 08:22:07,Am constantly monitoring the unfortunate situation in Uttarakhand. India stands with Uttarakhand and the nation pra… https://t.co/6R39yFpXiL
1358306667591475210,2021-02-07 06:48:40,"Addressing a public meeting in Sonitpur district, Assam. https://t.co/LnRt81JyB6"
1358251040617938945,2021-02-07 03:07:37,"Leaving for Assam and West Bengal. Do watch the programmes LIVE.

#AatmanirbharPurviBharat https://t.co/ZRjXQoXK9B"
1358081824291909633,2021-02-06 15:55:13,Glad to see immense enthusiasm in Assam. Happy to be getting yet another opportunity to be in the state tomorrow. W… https://t.co/Jp4D9OZtoV
